{
  "schema_version": 1,
  "ticker": "SJM",
  "period": "2026-Q3",
  "period_end": "2026-01-31",
  "currency": "USD",
  "scale": "million",
  "extracted_at": "2026-02-26",
  "extraction_method": "sec_xbrl",
  "source_documents": [
    {
      "source_id": "sec-0000091419-26-000016",
      "source_file": "raw/sec-filings/SJM/0000091419-26-000016.json"
    }
  ],
  "debt_totals": {
    "short_term_financial_debt": {
      "value": 486.9,
      "raw_quoted_value": "486.9",
      "currency": "USD",
      "scale": "million",
      "status": "reported",
      "evidence": {
        "source_id": "sec-0000091419-26-000016",
        "source_file": "raw/sec-filings/SJM/0000091419-26-000016.json",
        "page": null,
        "quoted_text": "SEC Inline XBRL fact {http://fasb.org/us-gaap/2025}ShortTermBorrowings#c-6"
      }
    },
    "current_portion_long_term_debt": {
      "value": null,
      "raw_quoted_value": null,
      "currency": null,
      "scale": null,
      "status": "not_disclosed",
      "evidence": null
    },
    "long_term_financial_debt": {
      "value": 6841.3,
      "raw_quoted_value": "6841.3",
      "currency": "USD",
      "scale": "million",
      "status": "reported",
      "evidence": {
        "source_id": "sec-0000091419-26-000016",
        "source_file": "raw/sec-filings/SJM/0000091419-26-000016.json",
        "page": null,
        "quoted_text": "SEC Inline XBRL fact {http://fasb.org/us-gaap/2025}LongTermDebtNoncurrent#c-6"
      }
    },
    "lease_liabilities_current": {
      "value": 33.6,
      "raw_quoted_value": "33.6",
      "currency": "USD",
      "scale": "million",
      "status": "reported",
      "evidence": {
        "source_id": "sec-0000091419-26-000016",
        "source_file": "raw/sec-filings/SJM/0000091419-26-000016.json",
        "page": null,
        "quoted_text": "SEC Inline XBRL fact {http://fasb.org/us-gaap/2025}OperatingLeaseLiabilityCurrent#c-6"
      }
    },
    "lease_liabilities_noncurrent": {
      "value": 126.1,
      "raw_quoted_value": "126.1",
      "currency": "USD",
      "scale": "million",
      "status": "reported",
      "evidence": {
        "source_id": "sec-0000091419-26-000016",
        "source_file": "raw/sec-filings/SJM/0000091419-26-000016.json",
        "page": null,
        "quoted_text": "SEC Inline XBRL fact {http://fasb.org/us-gaap/2025}OperatingLeaseLiabilityNoncurrent#c-6"
      }
    },
    "cash_and_cash_equivalents": {
      "value": 52.8,
      "raw_quoted_value": "52.8",
      "currency": "USD",
      "scale": "million",
      "status": "reported",
      "evidence": {
        "source_id": "sec-0000091419-26-000016",
        "source_file": "raw/sec-filings/SJM/0000091419-26-000016.json",
        "page": null,
        "quoted_text": "SEC Inline XBRL fact {http://fasb.org/us-gaap/2025}CashCashEquivalentsRestrictedCashAndRestrictedCashEquivalents#c-6"
      }
    }
  },
  "maturity_profile": [],
  "currency_profile": [],
  "interest_profile": {
    "fixed_rate_debt": {
      "value": null,
      "raw_quoted_value": null,
      "currency": null,
      "scale": null,
      "status": "not_disclosed",
      "evidence": null
    },
    "floating_rate_debt": {
      "value": null,
      "raw_quoted_value": null,
      "currency": null,
      "scale": null,
      "status": "not_disclosed",
      "evidence": null
    },
    "weighted_average_rates": []
  },
  "risk_sensitivities": {
    "fx_sensitivity": [],
    "interest_rate_sensitivity": []
  },
  "liquidity_support": {
    "undrawn_credit_facilities": {
      "value": null,
      "raw_quoted_value": null,
      "currency": null,
      "scale": null,
      "status": "not_disclosed",
      "evidence": null
    },
    "committed_facilities": {
      "value": null,
      "raw_quoted_value": null,
      "currency": null,
      "scale": null,
      "status": "not_disclosed",
      "evidence": null
    },
    "covenants_or_defaults": {
      "value": null,
      "status": "not_disclosed",
      "evidence": null
    }
  },
  "refinancing_disclosures": [],
  "diagnostics": {
    "total_financial_debt": {
      "status": "available",
      "value": 7328.2,
      "unit": "source_scale"
    },
    "near_term_financial_debt": {
      "status": "available",
      "value": 486.9,
      "unit": "source_scale"
    },
    "cash_to_near_term_debt": {
      "status": "available",
      "value": 0.10844115834873691,
      "unit": "ratio"
    },
    "near_term_debt_share": {
      "status": "available",
      "value": 0.06644196392019869,
      "unit": "ratio"
    },
    "floating_rate_debt_share": {
      "status": "unavailable",
      "value": null,
      "unit": "ratio"
    },
    "refinancing_pressure": {
      "status": "available",
      "level": "high",
      "confidence": "medium",
      "reason_codes": [
        "cash_covers_less_than_25pct_of_near_term_debt"
      ]
    }
  }
}
