{
  "schema_version": 1,
  "ticker": "TGT",
  "period": "2025-FY",
  "period_end": "2026-01-31",
  "currency": "USD",
  "scale": "million",
  "extracted_at": "2026-03-11",
  "extraction_method": "sec_xbrl",
  "source_documents": [
    {
      "source_id": "sec-0000027419-26-000016",
      "source_file": "raw/sec-filings/TGT/0000027419-26-000016.json"
    }
  ],
  "debt_totals": {
    "short_term_financial_debt": {
      "value": null,
      "raw_quoted_value": null,
      "currency": null,
      "scale": null,
      "status": "not_disclosed",
      "evidence": null
    },
    "current_portion_long_term_debt": {
      "value": 2130,
      "raw_quoted_value": "2130",
      "currency": "USD",
      "scale": "million",
      "status": "reported",
      "evidence": {
        "source_id": "sec-0000027419-26-000016",
        "source_file": "raw/sec-filings/TGT/0000027419-26-000016.json",
        "page": null,
        "quoted_text": "SEC Inline XBRL fact {http://fasb.org/us-gaap/2025}LongTermDebtAndCapitalLeaseObligationsCurrent#c-6"
      }
    },
    "long_term_financial_debt": {
      "value": 14326,
      "raw_quoted_value": "14326",
      "currency": "USD",
      "scale": "million",
      "status": "reported",
      "evidence": {
        "source_id": "sec-0000027419-26-000016",
        "source_file": "raw/sec-filings/TGT/0000027419-26-000016.json",
        "page": null,
        "quoted_text": "SEC Inline XBRL fact {http://fasb.org/us-gaap/2025}LongTermDebtAndCapitalLeaseObligations#c-6"
      }
    },
    "lease_liabilities_current": {
      "value": 372,
      "raw_quoted_value": "372",
      "currency": "USD",
      "scale": "million",
      "status": "reported",
      "evidence": {
        "source_id": "sec-0000027419-26-000016",
        "source_file": "raw/sec-filings/TGT/0000027419-26-000016.json",
        "page": null,
        "quoted_text": "SEC Inline XBRL fact {http://fasb.org/us-gaap/2025}OperatingLeaseLiabilityCurrent#c-6"
      }
    },
    "lease_liabilities_noncurrent": {
      "value": 3462,
      "raw_quoted_value": "3462",
      "currency": "USD",
      "scale": "million",
      "status": "reported",
      "evidence": {
        "source_id": "sec-0000027419-26-000016",
        "source_file": "raw/sec-filings/TGT/0000027419-26-000016.json",
        "page": null,
        "quoted_text": "SEC Inline XBRL fact {http://fasb.org/us-gaap/2025}OperatingLeaseLiabilityNoncurrent#c-6"
      }
    },
    "cash_and_cash_equivalents": {
      "value": 5488,
      "raw_quoted_value": "5488",
      "currency": "USD",
      "scale": "million",
      "status": "reported",
      "evidence": {
        "source_id": "sec-0000027419-26-000016",
        "source_file": "raw/sec-filings/TGT/0000027419-26-000016.json",
        "page": null,
        "quoted_text": "SEC Inline XBRL fact {http://fasb.org/us-gaap/2025}CashCashEquivalentsRestrictedCashAndRestrictedCashEquivalents#c-6"
      }
    }
  },
  "maturity_profile": [],
  "currency_profile": [
    {
      "value": 2000.0,
      "raw_quoted_value": "2000000000.0",
      "currency": "USD",
      "debt_currency": "USD",
      "scale": "million",
      "status": "reported",
      "evidence": {
        "source_id": "sec-0000027419-26-000016",
        "source_file": "raw/sec-filings/TGT/0000027419-26-000016.json",
        "page": null,
        "quoted_text": "Aggregate of 3 SEC Inline XBRL DebtInstrumentFaceAmount facts"
      },
      "liability_scope": "Debt instruments with disclosed face amount"
    }
  ],
  "interest_profile": {
    "fixed_rate_debt": {
      "value": null,
      "raw_quoted_value": null,
      "currency": null,
      "scale": null,
      "status": "not_disclosed",
      "evidence": null
    },
    "floating_rate_debt": {
      "value": null,
      "raw_quoted_value": null,
      "currency": null,
      "scale": null,
      "status": "not_disclosed",
      "evidence": null
    },
    "weighted_average_rates": []
  },
  "risk_sensitivities": {
    "fx_sensitivity": [],
    "interest_rate_sensitivity": []
  },
  "liquidity_support": {
    "undrawn_credit_facilities": {
      "value": null,
      "raw_quoted_value": null,
      "currency": null,
      "scale": null,
      "status": "not_disclosed",
      "evidence": null
    },
    "committed_facilities": {
      "value": null,
      "raw_quoted_value": null,
      "currency": null,
      "scale": null,
      "status": "not_disclosed",
      "evidence": null
    },
    "covenants_or_defaults": {
      "value": null,
      "status": "not_disclosed",
      "evidence": null
    }
  },
  "refinancing_disclosures": [],
  "diagnostics": {
    "total_financial_debt": {
      "status": "available",
      "value": 16456.0,
      "unit": "source_scale"
    },
    "near_term_financial_debt": {
      "status": "available",
      "value": 2130.0,
      "unit": "source_scale"
    },
    "cash_to_near_term_debt": {
      "status": "available",
      "value": 2.576525821596244,
      "unit": "ratio"
    },
    "near_term_debt_share": {
      "status": "available",
      "value": 0.12943607194944093,
      "unit": "ratio"
    },
    "floating_rate_debt_share": {
      "status": "unavailable",
      "value": null,
      "unit": "ratio"
    },
    "refinancing_pressure": {
      "status": "available",
      "level": "low",
      "confidence": "medium",
      "reason_codes": [
        "cash_and_maturity_indicators_are_comfortable"
      ]
    }
  }
}
