{
  "schema_version": 1,
  "ticker": "FIZZ",
  "period": "2026-FY",
  "period_end": "2026-05-02",
  "currency": "USD",
  "scale": "million",
  "extracted_at": "2026-07-01",
  "extraction_method": "sec_xbrl",
  "source_documents": [
    {
      "source_id": "sec-0001437749-26-022315",
      "source_file": "raw/sec-filings/FIZZ/0001437749-26-022315.json"
    }
  ],
  "debt_totals": {
    "short_term_financial_debt": {
      "value": null,
      "raw_quoted_value": null,
      "currency": null,
      "scale": null,
      "status": "not_disclosed",
      "evidence": null
    },
    "current_portion_long_term_debt": {
      "value": null,
      "raw_quoted_value": null,
      "currency": null,
      "scale": null,
      "status": "not_disclosed",
      "evidence": null
    },
    "long_term_financial_debt": {
      "value": null,
      "raw_quoted_value": null,
      "currency": null,
      "scale": null,
      "status": "not_disclosed",
      "evidence": null
    },
    "lease_liabilities_current": {
      "value": 14.457,
      "raw_quoted_value": "14.457",
      "currency": "USD",
      "scale": "million",
      "status": "reported",
      "evidence": {
        "source_id": "sec-0001437749-26-022315",
        "source_file": "raw/sec-filings/FIZZ/0001437749-26-022315.json",
        "page": null,
        "quoted_text": "SEC Inline XBRL fact {http://fasb.org/us-gaap/2026}OperatingLeaseLiabilityCurrent#i_2026-05-02"
      }
    },
    "lease_liabilities_noncurrent": {
      "value": 44.479,
      "raw_quoted_value": "44.479",
      "currency": "USD",
      "scale": "million",
      "status": "reported",
      "evidence": {
        "source_id": "sec-0001437749-26-022315",
        "source_file": "raw/sec-filings/FIZZ/0001437749-26-022315.json",
        "page": null,
        "quoted_text": "SEC Inline XBRL fact {http://fasb.org/us-gaap/2026}OperatingLeaseLiabilityNoncurrent#i_2026-05-02"
      }
    },
    "cash_and_cash_equivalents": {
      "value": 349.543,
      "raw_quoted_value": "349.543",
      "currency": "USD",
      "scale": "million",
      "status": "reported",
      "evidence": {
        "source_id": "sec-0001437749-26-022315",
        "source_file": "raw/sec-filings/FIZZ/0001437749-26-022315.json",
        "page": null,
        "quoted_text": "SEC Inline XBRL fact {http://fasb.org/us-gaap/2026}CashAndCashEquivalentsAtCarryingValue#i_2026-05-02"
      }
    }
  },
  "maturity_profile": [],
  "currency_profile": [
    {
      "value": 50.0,
      "raw_quoted_value": "50000000.0",
      "currency": "USD",
      "debt_currency": "USD",
      "scale": "million",
      "status": "reported",
      "evidence": {
        "source_id": "sec-0001437749-26-022315",
        "source_file": "raw/sec-filings/FIZZ/0001437749-26-022315.json",
        "page": null,
        "quoted_text": "Aggregate of 1 SEC Inline XBRL DebtInstrumentFaceAmount facts"
      },
      "liability_scope": "Debt instruments with disclosed face amount"
    }
  ],
  "interest_profile": {
    "fixed_rate_debt": {
      "value": null,
      "raw_quoted_value": null,
      "currency": null,
      "scale": null,
      "status": "not_disclosed",
      "evidence": null
    },
    "floating_rate_debt": {
      "value": null,
      "raw_quoted_value": null,
      "currency": null,
      "scale": null,
      "status": "not_disclosed",
      "evidence": null
    },
    "weighted_average_rates": []
  },
  "risk_sensitivities": {
    "fx_sensitivity": [],
    "interest_rate_sensitivity": []
  },
  "liquidity_support": {
    "undrawn_credit_facilities": {
      "value": null,
      "raw_quoted_value": null,
      "currency": null,
      "scale": null,
      "status": "not_disclosed",
      "evidence": null
    },
    "committed_facilities": {
      "value": null,
      "raw_quoted_value": null,
      "currency": null,
      "scale": null,
      "status": "not_disclosed",
      "evidence": null
    },
    "covenants_or_defaults": {
      "value": null,
      "status": "not_disclosed",
      "evidence": null
    }
  },
  "refinancing_disclosures": [],
  "diagnostics": {
    "total_financial_debt": {
      "status": "unavailable",
      "value": null,
      "unit": "source_scale"
    },
    "near_term_financial_debt": {
      "status": "unavailable",
      "value": null,
      "unit": "source_scale"
    },
    "cash_to_near_term_debt": {
      "status": "unavailable",
      "value": null,
      "unit": "ratio"
    },
    "near_term_debt_share": {
      "status": "unavailable",
      "value": null,
      "unit": "ratio"
    },
    "floating_rate_debt_share": {
      "status": "unavailable",
      "value": null,
      "unit": "ratio"
    },
    "refinancing_pressure": {
      "status": "insufficient_data",
      "level": null,
      "confidence": "low",
      "reason_codes": [
        "insufficient_xbrl_debt_components"
      ]
    }
  }
}
