{
  "schema_version": 1,
  "ticker": "WMT",
  "period": "2025-FY",
  "period_end": "2025-01-31",
  "currency": "USD",
  "scale": "million",
  "extracted_at": "2025-03-14",
  "extraction_method": "sec_xbrl",
  "source_documents": [
    {
      "source_id": "sec-0000104169-25-000021",
      "source_file": "raw/sec-filings/WMT/0000104169-25-000021.json"
    }
  ],
  "debt_totals": {
    "short_term_financial_debt": {
      "value": 3068,
      "raw_quoted_value": "3068",
      "currency": "USD",
      "scale": "million",
      "status": "reported",
      "evidence": {
        "source_id": "sec-0000104169-25-000021",
        "source_file": "raw/sec-filings/WMT/0000104169-25-000021.json",
        "page": null,
        "quoted_text": "SEC Inline XBRL fact {http://fasb.org/us-gaap/2024}ShortTermBorrowings#c-16"
      }
    },
    "current_portion_long_term_debt": {
      "value": 2598,
      "raw_quoted_value": "2598",
      "currency": "USD",
      "scale": "million",
      "status": "reported",
      "evidence": {
        "source_id": "sec-0000104169-25-000021",
        "source_file": "raw/sec-filings/WMT/0000104169-25-000021.json",
        "page": null,
        "quoted_text": "SEC Inline XBRL fact {http://fasb.org/us-gaap/2024}LongTermDebtCurrent#c-16"
      }
    },
    "long_term_financial_debt": {
      "value": 33401,
      "raw_quoted_value": "33401",
      "currency": "USD",
      "scale": "million",
      "status": "reported",
      "evidence": {
        "source_id": "sec-0000104169-25-000021",
        "source_file": "raw/sec-filings/WMT/0000104169-25-000021.json",
        "page": null,
        "quoted_text": "SEC Inline XBRL fact {http://fasb.org/us-gaap/2024}LongTermDebtNoncurrent#c-16"
      }
    },
    "lease_liabilities_current": {
      "value": 1499,
      "raw_quoted_value": "1499",
      "currency": "USD",
      "scale": "million",
      "status": "reported",
      "evidence": {
        "source_id": "sec-0000104169-25-000021",
        "source_file": "raw/sec-filings/WMT/0000104169-25-000021.json",
        "page": null,
        "quoted_text": "SEC Inline XBRL fact {http://fasb.org/us-gaap/2024}OperatingLeaseLiabilityCurrent#c-16"
      }
    },
    "lease_liabilities_noncurrent": {
      "value": 12825,
      "raw_quoted_value": "12825",
      "currency": "USD",
      "scale": "million",
      "status": "reported",
      "evidence": {
        "source_id": "sec-0000104169-25-000021",
        "source_file": "raw/sec-filings/WMT/0000104169-25-000021.json",
        "page": null,
        "quoted_text": "SEC Inline XBRL fact {http://fasb.org/us-gaap/2024}OperatingLeaseLiabilityNoncurrent#c-16"
      }
    },
    "cash_and_cash_equivalents": {
      "value": 9037,
      "raw_quoted_value": "9037",
      "currency": "USD",
      "scale": "million",
      "status": "reported",
      "evidence": {
        "source_id": "sec-0000104169-25-000021",
        "source_file": "raw/sec-filings/WMT/0000104169-25-000021.json",
        "page": null,
        "quoted_text": "SEC Inline XBRL fact {http://fasb.org/us-gaap/2024}CashAndCashEquivalentsAtCarryingValue#c-16"
      }
    }
  },
  "maturity_profile": [],
  "currency_profile": [],
  "interest_profile": {
    "fixed_rate_debt": {
      "value": null,
      "raw_quoted_value": null,
      "currency": null,
      "scale": null,
      "status": "not_disclosed",
      "evidence": null
    },
    "floating_rate_debt": {
      "value": null,
      "raw_quoted_value": null,
      "currency": null,
      "scale": null,
      "status": "not_disclosed",
      "evidence": null
    },
    "weighted_average_rates": []
  },
  "risk_sensitivities": {
    "fx_sensitivity": [],
    "interest_rate_sensitivity": []
  },
  "liquidity_support": {
    "undrawn_credit_facilities": {
      "value": null,
      "raw_quoted_value": null,
      "currency": null,
      "scale": null,
      "status": "not_disclosed",
      "evidence": null
    },
    "committed_facilities": {
      "value": null,
      "raw_quoted_value": null,
      "currency": null,
      "scale": null,
      "status": "not_disclosed",
      "evidence": null
    },
    "covenants_or_defaults": {
      "value": null,
      "status": "not_disclosed",
      "evidence": null
    }
  },
  "refinancing_disclosures": [],
  "diagnostics": {
    "total_financial_debt": {
      "status": "available",
      "value": 39067.0,
      "unit": "source_scale"
    },
    "near_term_financial_debt": {
      "status": "available",
      "value": 5666.0,
      "unit": "source_scale"
    },
    "cash_to_near_term_debt": {
      "status": "available",
      "value": 1.5949523473349805,
      "unit": "ratio"
    },
    "near_term_debt_share": {
      "status": "available",
      "value": 0.1450328922108173,
      "unit": "ratio"
    },
    "floating_rate_debt_share": {
      "status": "unavailable",
      "value": null,
      "unit": "ratio"
    },
    "refinancing_pressure": {
      "status": "available",
      "level": "low",
      "confidence": "medium",
      "reason_codes": [
        "cash_and_maturity_indicators_are_comfortable"
      ]
    }
  }
}
