{
  "schema_version": 1,
  "ticker": "DG",
  "period": "2024-FY",
  "period_end": "2025-01-31",
  "currency": "USD",
  "scale": "million",
  "extracted_at": "2025-03-21",
  "extraction_method": "sec_xbrl",
  "source_documents": [
    {
      "source_id": "sec-0001558370-25-003413",
      "source_file": "raw/sec-filings/DG/0001558370-25-003413.json"
    }
  ],
  "debt_totals": {
    "short_term_financial_debt": {
      "value": null,
      "raw_quoted_value": null,
      "currency": null,
      "scale": null,
      "status": "not_disclosed",
      "evidence": null
    },
    "current_portion_long_term_debt": {
      "value": 519.463,
      "raw_quoted_value": "519.463",
      "currency": "USD",
      "scale": "million",
      "status": "reported",
      "evidence": {
        "source_id": "sec-0001558370-25-003413",
        "source_file": "raw/sec-filings/DG/0001558370-25-003413.json",
        "page": null,
        "quoted_text": "SEC Inline XBRL fact {http://fasb.org/us-gaap/2024}LongTermDebtAndCapitalLeaseObligationsCurrent#As_Of_1_31_2025_67-TgTjM1UGqdlxEC-WPOg"
      }
    },
    "long_term_financial_debt": {
      "value": 5719.025,
      "raw_quoted_value": "5719.025",
      "currency": "USD",
      "scale": "million",
      "status": "reported",
      "evidence": {
        "source_id": "sec-0001558370-25-003413",
        "source_file": "raw/sec-filings/DG/0001558370-25-003413.json",
        "page": null,
        "quoted_text": "SEC Inline XBRL fact {http://fasb.org/us-gaap/2024}LongTermDebtAndCapitalLeaseObligations#As_Of_1_31_2025_67-TgTjM1UGqdlxEC-WPOg"
      }
    },
    "lease_liabilities_current": {
      "value": 1460.114,
      "raw_quoted_value": "1460.114",
      "currency": "USD",
      "scale": "million",
      "status": "reported",
      "evidence": {
        "source_id": "sec-0001558370-25-003413",
        "source_file": "raw/sec-filings/DG/0001558370-25-003413.json",
        "page": null,
        "quoted_text": "SEC Inline XBRL fact {http://fasb.org/us-gaap/2024}OperatingLeaseLiabilityCurrent#As_Of_1_31_2025_67-TgTjM1UGqdlxEC-WPOg"
      }
    },
    "lease_liabilities_noncurrent": {
      "value": 9764.783,
      "raw_quoted_value": "9764.783",
      "currency": "USD",
      "scale": "million",
      "status": "reported",
      "evidence": {
        "source_id": "sec-0001558370-25-003413",
        "source_file": "raw/sec-filings/DG/0001558370-25-003413.json",
        "page": null,
        "quoted_text": "SEC Inline XBRL fact {http://fasb.org/us-gaap/2024}OperatingLeaseLiabilityNoncurrent#As_Of_1_31_2025_67-TgTjM1UGqdlxEC-WPOg"
      }
    },
    "cash_and_cash_equivalents": {
      "value": 932.576,
      "raw_quoted_value": "932.576",
      "currency": "USD",
      "scale": "million",
      "status": "reported",
      "evidence": {
        "source_id": "sec-0001558370-25-003413",
        "source_file": "raw/sec-filings/DG/0001558370-25-003413.json",
        "page": null,
        "quoted_text": "SEC Inline XBRL fact {http://fasb.org/us-gaap/2024}CashAndCashEquivalentsAtCarryingValue#As_Of_1_31_2025_67-TgTjM1UGqdlxEC-WPOg"
      }
    }
  },
  "maturity_profile": [],
  "currency_profile": [],
  "interest_profile": {
    "fixed_rate_debt": {
      "value": null,
      "raw_quoted_value": null,
      "currency": null,
      "scale": null,
      "status": "not_disclosed",
      "evidence": null
    },
    "floating_rate_debt": {
      "value": null,
      "raw_quoted_value": null,
      "currency": null,
      "scale": null,
      "status": "not_disclosed",
      "evidence": null
    },
    "weighted_average_rates": []
  },
  "risk_sensitivities": {
    "fx_sensitivity": [],
    "interest_rate_sensitivity": []
  },
  "liquidity_support": {
    "undrawn_credit_facilities": {
      "value": null,
      "raw_quoted_value": null,
      "currency": null,
      "scale": null,
      "status": "not_disclosed",
      "evidence": null
    },
    "committed_facilities": {
      "value": null,
      "raw_quoted_value": null,
      "currency": null,
      "scale": null,
      "status": "not_disclosed",
      "evidence": null
    },
    "covenants_or_defaults": {
      "value": null,
      "status": "not_disclosed",
      "evidence": null
    }
  },
  "refinancing_disclosures": [],
  "diagnostics": {
    "total_financial_debt": {
      "status": "available",
      "value": 6238.487999999999,
      "unit": "source_scale"
    },
    "near_term_financial_debt": {
      "status": "available",
      "value": 519.463,
      "unit": "source_scale"
    },
    "cash_to_near_term_debt": {
      "status": "available",
      "value": 1.7952693454586757,
      "unit": "ratio"
    },
    "near_term_debt_share": {
      "status": "available",
      "value": 0.08326745198516051,
      "unit": "ratio"
    },
    "floating_rate_debt_share": {
      "status": "unavailable",
      "value": null,
      "unit": "ratio"
    },
    "refinancing_pressure": {
      "status": "available",
      "level": "low",
      "confidence": "medium",
      "reason_codes": [
        "cash_and_maturity_indicators_are_comfortable"
      ]
    }
  }
}
